{
  "id": "process_processo_de_ferias",
  "name": "Processo de férias",
  "flows": [
    {
      "id": "flow_0001",
      "source": "task_aprovar_ferias",
      "target": "gateway_aprovar_ferias"
    },
    {
      "id": "flow_0002",
      "source": "task_registrar_ferias",
      "target": "end_process_finished"
    },
    {
      "id": "flow_0003",
      "source": "task_comunicar_motivo_ao_servidor",
      "target": "end_process_finished"
    },
    {
      "id": "flow_0004",
      "label": "Aprovado",
      "source": "gateway_aprovar_ferias",
      "target": "task_registrar_ferias",
      "condition": {
        "op": "eq",
        "left": {
          "var": "var_aprovar_ferias_decision"
        },
        "right": {
          "literal": "approved"
        }
      }
    },
    {
      "id": "flow_0005",
      "label": "Rejeitado",
      "source": "gateway_aprovar_ferias",
      "target": "task_comunicar_motivo_ao_servidor",
      "condition": {
        "op": "eq",
        "left": {
          "var": "var_aprovar_ferias_decision"
        },
        "right": {
          "literal": "rejected"
        }
      }
    },
    {
      "id": "flow_0006",
      "source": "task_informar_periodo_de_ferias",
      "target": "task_aprovar_ferias"
    },
    {
      "id": "flow_0007",
      "source": "start_processo_de_ferias",
      "target": "task_informar_periodo_de_ferias"
    }
  ],
  "forms": [
    {
      "id": "form_processo_de_ferias_request",
      "name": "Processo de férias — solicitação",
      "usage": "start",
      "fields": [
        {
          "key": "field_periodo",
          "type": "text",
          "label": "periodo",
          "bindTo": "var_form_processo_de_ferias_request_periodo",
          "required": true
        }
      ]
    },
    {
      "id": "form_aprovar_ferias",
      "name": "Aprovar férias",
      "usage": "task",
      "fields": [
        {
          "key": "field_decisao",
          "type": "select",
          "label": "Decisão",
          "bindTo": "var_aprovar_ferias_decision",
          "options": [
            {
              "label": "Aprovar",
              "value": "approved"
            },
            {
              "label": "Rejeitar",
              "value": "rejected"
            }
          ],
          "required": true
        },
        {
          "key": "field_motivo_da_rejeicao",
          "type": "textarea",
          "label": "Motivo da rejeição",
          "bindTo": "var_aprovar_ferias_rejection_reason",
          "required": false,
          "visibleWhen": {
            "op": "eq",
            "left": {
              "var": "var_aprovar_ferias_decision"
            },
            "right": {
              "literal": "rejected"
            }
          },
          "requiredWhen": {
            "op": "eq",
            "left": {
              "var": "var_aprovar_ferias_decision"
            },
            "right": {
              "literal": "rejected"
            }
          }
        }
      ]
    }
  ],
  "nodes": [
    {
      "id": "start_processo_de_ferias",
      "name": "Processo de férias",
      "type": "startEvent",
      "formId": "form_processo_de_ferias_request"
    },
    {
      "id": "end_process_finished",
      "name": "Processo encerrado",
      "type": "endEvent"
    },
    {
      "id": "task_aprovar_ferias",
      "name": "Aprovar férias",
      "type": "userTask",
      "formId": "form_aprovar_ferias",
      "roleId": "role_gestor"
    },
    {
      "id": "gateway_aprovar_ferias",
      "name": "Aprovar férias",
      "type": "exclusiveGateway"
    },
    {
      "id": "task_registrar_ferias",
      "name": "Registrar férias",
      "type": "userTask",
      "roleId": "role_rh"
    },
    {
      "id": "task_comunicar_motivo_ao_servidor",
      "name": "Comunicar motivo ao servidor",
      "type": "userTask",
      "roleId": "role_servidor"
    },
    {
      "id": "task_informar_periodo_de_ferias",
      "name": "Informar período de férias",
      "type": "userTask",
      "roleId": "role_servidor"
    }
  ],
  "roles": [
    {
      "id": "role_servidor",
      "label": "Servidor",
      "resolution": "unresolved"
    },
    {
      "id": "role_gestor",
      "label": "Gestor",
      "resolution": "unresolved"
    },
    {
      "id": "role_rh",
      "label": "RH",
      "resolution": "unresolved"
    }
  ],
  "locale": "pt-BR",
  "status": "needs-input",
  "metadata": {
    "modelId": "openai/gpt-oss-120b",
    "revision": 0,
    "knowledgeVersion": "1.1.0",
    "requirementProvenance": [
      {
        "name": "Servidor",
        "path": "roles/servidor",
        "source": "user",
        "confirmed": true,
        "evidenceSha256": "5d240f37dd5e1c1f871d41e92a4ae7243701173648350415667d2867e5a63d66"
      },
      {
        "name": "Servidor",
        "path": "roles/servidor/assignment",
        "source": "inference",
        "confirmed": false
      },
      {
        "name": "Gestor",
        "path": "roles/gestor",
        "source": "user",
        "confirmed": true,
        "evidenceSha256": "57ba643731cc7e0242b7ac183b7363b36389c2b5ad72d408194e41e49aa9448d"
      },
      {
        "name": "Gestor",
        "path": "roles/gestor/assignment",
        "source": "inference",
        "confirmed": false
      },
      {
        "name": "RH",
        "path": "roles/rh",
        "source": "user",
        "confirmed": true,
        "evidenceSha256": "f73fa4856d029e63348df2d4a12aae3b475d318fc9637e516f33d8d06c87324b"
      },
      {
        "name": "RH",
        "path": "roles/rh/assignment",
        "source": "inference",
        "confirmed": false
      },
      {
        "name": "periodo",
        "path": "startFields/periodo",
        "source": "user",
        "confirmed": true,
        "evidenceSha256": "d66ad709cbd4e478db1e50fcf8c46221fb756952a924f2720cb842b376dc8a22"
      },
      {
        "name": "Informar período de férias",
        "path": "activities/0",
        "source": "user",
        "confirmed": true,
        "evidenceSha256": "5d240f37dd5e1c1f871d41e92a4ae7243701173648350415667d2867e5a63d66"
      },
      {
        "name": "Aprovar férias",
        "path": "activities/1",
        "source": "user",
        "confirmed": true,
        "evidenceSha256": "57ba643731cc7e0242b7ac183b7363b36389c2b5ad72d408194e41e49aa9448d"
      },
      {
        "name": "Registrar férias",
        "path": "activities/1/0",
        "source": "user",
        "confirmed": true,
        "evidenceSha256": "f73fa4856d029e63348df2d4a12aae3b475d318fc9637e516f33d8d06c87324b"
      },
      {
        "name": "Comunicar motivo ao servidor",
        "path": "activities/1/1",
        "source": "user",
        "confirmed": true,
        "evidenceSha256": "74178f0d7ae2e6d97884e2f2b90262089159689562daf85815fef2db7b5b1ead"
      }
    ]
  },
  "policies": {
    "allowExecution": false,
    "manualApprovalRequired": true
  },
  "variables": [
    {
      "key": "var_form_processo_de_ferias_request_periodo",
      "type": "string",
      "scope": "process",
      "source": {
        "kind": "form",
        "formId": "form_processo_de_ferias_request",
        "fieldKey": "field_periodo"
      },
      "required": true,
      "sensitive": false
    },
    {
      "key": "var_aprovar_ferias_decision",
      "type": "string",
      "scope": "process",
      "source": {
        "kind": "form",
        "formId": "form_aprovar_ferias",
        "fieldKey": "field_decisao"
      },
      "required": true,
      "sensitive": false,
      "enumValues": [
        "approved",
        "rejected"
      ]
    },
    {
      "key": "var_aprovar_ferias_rejection_reason",
      "type": "string",
      "scope": "process",
      "source": {
        "kind": "form",
        "formId": "form_aprovar_ferias",
        "fieldKey": "field_motivo_da_rejeicao"
      },
      "required": false,
      "sensitive": false
    }
  ],
  "assumptions": [],
  "description": "Gerenciar solicitação de férias",
  "schemaVersion": "1.0.0",
  "targetProfile": "generic-bpmn2",
  "pendingQuestions": [
    {
      "id": "pq_1",
      "blocking": true,
      "question": "Como o runtime deve atribuir o papel “Servidor”? A identidade do responsável pode ser configurada depois da prévia.",
      "relatedNodeId": "task_comunicar_motivo_ao_servidor"
    },
    {
      "id": "pq_2",
      "blocking": true,
      "question": "Como o runtime deve atribuir o papel “Gestor”? A identidade do responsável pode ser configurada depois da prévia.",
      "relatedNodeId": "task_aprovar_ferias"
    },
    {
      "id": "pq_3",
      "blocking": true,
      "question": "Como o runtime deve atribuir o papel “RH”? A identidade do responsável pode ser configurada depois da prévia.",
      "relatedNodeId": "task_registrar_ferias"
    }
  ]
}
